"30.12.2022","FDO","QNB FİNANS PORTFÖY SULTAN SERBEST(DÖVİZ) ÖZEL FON","18,353275","3.320.021,00","1","60.933.259,07"
"30.12.2022","FDV","AZİMUT PORTFÖY BKS SERBEST ÖZEL FON","0,000000","0,00","0","0,00"
"30.12.2022","FDZ","AZİMUT PORTFÖY 16.0 SERBEST FON","0,822496","39.499.307,00","0","32.488.005,18"
"30.12.2022","FFD","FİBA PORTFÖY ÜÇÜNCÜ PARA PİYASASI (TL) FONU","0,013326","3.893.523.000,00","360","51.883.398,03"
"30.12.2022","FFF","QNB FİNANS PORTFÖY BERİL SERBEST(DÖVİZ) ÖZEL FON","18,742180","10.410.988,00","1","195.124.613,02"
"30.12.2022","FFH","QNB FİNANS PORTFÖY ÇOKLU VARLIK KATILIM FONU","2,083752","126.673.875,00","1.121","263.956.886,32"
"30.12.2022","FFO","QNB FİNANS PORTFÖY SER SERBEST (DÖVİZ) ÖZEL FON","20,125378","3.086.678,00","7","62.120.560,01"
"30.12.2022","FFP","QNB FİNANS PORTFÖY FON SEPETİ FONU","1,946554","389.688.052,00","2.409","758.548.906,31"
"30.12.2022","FFS","FİBA PORTFÖY 2023 SERBEST (DÖVİZ) FON","22,203821","16.439.973,00","260","365.030.220,43"
"30.12.2022","FHZ","QNB FİNANS PORTFÖY HUZUR SERBEST (DÖVİZ) ÖZEL FON","18,906035","10.420.817,00","3","197.016.334,87"
"30.12.2022","FIB","FİBA PORTFÖY ALTIN FONU","0,088529","3.641.639.559,39","4.913","322.391.706,25"
"30.12.2022","FID","FİBA PORTFÖY ÇOKLU VARLIK İKİNCİ DEĞİŞKEN FON","0,349388","4.131.317.902,00","3.952","1.443.434.318,33"
"30.12.2022","FIL","FİBA PORTFÖY PARA PİYASASI (TL) FONU","0,087934","12.780.131.786,00","6.160","1.123.806.715,61"
"30.12.2022","FIT","FİBA PORTFÖY BORÇLANMA ARAÇLARI (TL) FONU","0,105471","97.740.119,00","156","10.308.770,36"
"30.12.2022","FI3","QNB FINANS PORTFÖY BORÇLANMA ARAÇLARI FONU","283,951787","193.784,74","9.788","55.025.523,22"
"30.12.2022","FI5","QNB FİNANS PORTFÖY PARA PİYASASI (TL) FONU","180,170874","10.319.668,27","15.971","1.859.303.652,51"
"30.12.2022","FJB","FİBA PORTFÖY BLOK ZİNCİRİ TEKNOLOJİLERİ SERBEST FON","1,087265","21.993.162,00","0","23.912.386,52"
"30.12.2022","FJC","FİBA PORTFÖY MELTEM ÜÇÜNCÜ SERBEST (DÖVİZ) FON","19,626978","4.054.582,00","28","79.579.193,15"
"30.12.2022","FJM","FİBA PORTFÖY MELTEM SERBEST (DÖVİZ) FON","19,479179","217.852.563,00","123","4.243.589.031,51"
"30.12.2022","FJN","FİBA PORTFÖY MELTEM İKİNCİ SERBEST (DÖVİZ) FON","19,438216","93.183.102,00","1.459","1.811.313.228,70"
"30.12.2022","FJZ","FİBA PORTFÖY FIRTINA SERBEST (DÖVİZ) FON","18,210136","2.904.541,00","66","52.892.085,62"
"30.12.2022","FNO","QNB FINANS PORTFÖY BIRINCI DEĞIŞKEN FON","0,050781","39.900.793.226,04","4.944","2.026.214.087,40"
"30.12.2022","FPE","FİBA PORTFÖY EUROBOND BORÇLANMA ARAÇLARI (DÖVİZ)FONU","21,683793","7.495.446,00","1.612","162.529.701,69"
"30.12.2022","FPH","FİBA PORTFÖY HİSSE SENEDİ (TL) FONU (HİSSE SENEDİ YOĞUN FON)","11,014519","101.948.307,00","3.768","1.122.911.550,97"
"30.12.2022","FPK","FİBA PORTFÖY KISA VADELİ BORÇLANMA ARAÇLARI (TL)FONU","0,026371","2.457.408.228,00","624","64.803.610,95"
"30.12.2022","FPR","STRATEJİ PORTFÖY FOREST HİSSE SENEDİ SERBEST FON (HİSSE SENEDİ YOĞUN FON)","2,903790","14.635.460,00","0","42.498.297,15"
"30.12.2022","FPZ","QNB FİNANS PORTFÖY BİRİNCİ SERBEST (DÖVİZ) FON","22,966074","30.579.152,00","453","702.283.060,31"
"30.12.2022","FP1","QNB FİNANS PORTFÖY BEREKET SERBEST (DÖVİZ) ÖZEL FON","0,000000","0,00","0","0,00"
"30.12.2022","FRA","AZIMUT PORTFÖY MAB SERBEST ÖZEL FON","13,686494","16.108.246,00","0","220.465.415,13"
"30.12.2022","FRZ","AZİMUT PORTFÖY FRZ SERBEST ÖZEL FON","4,960289","15.586.247,00","0","77.312.290,72"
"30.12.2022","FSE","QNB FİNANS PORTFÖY ONDÖRDÜNCÜ SERBEST (DÖVİZ) FON","19,490423","24.630.000,00","284","480.049.109,87"
"30.12.2022","FSF","FİBA PORTFÖY KISA VADELİ SERBEST (TL) FON","1,600254","62.142.812,00","63","99.444.310,49"
"30.12.2022","FSK","QNB FİNANS PORTFÖY KISA VADELİ SERBEST FON","1,466163","4.248.425,00","38","6.228.882,01"
"30.12.2022","FUA","AK PORTFÖY İHRACATÇI ŞİRKETLER HİSSE SENEDİ FONU (HİSSE SENEDİ YOĞUN FON)","2,491564","242.727.121,00","0","604.770.046,10"
"30.12.2022","FUB","QNB FINANS PORTFÖY EUROBOND (DÖVİZ) BORÇLANMA ARAÇLARI FONU","0,218023","2.277.772.262,00","2.431","496.607.869,88"
"30.12.2022","FUM","AK PORTFÖY ALESTA SERBEST (DÖVİZ) ÖZEL FON","19,339466","4.704.360,00","0","90.979.811,45"
"30.12.2022","FUP","QNB FİNANS PORTFÖY BAYSAN SERBEST (DÖVİZ) ÖZEL FON","27,148145","9.371.144,00","2","254.409.178,49"
"30.12.2022","FVL","FİBA PORTFÖY BİRİNCİ SERBEST (TL) FON","1,114579","17.439.939,00","4","19.438.185,84"
"30.12.2022","FVS","QNB FİNANS PORTFÖY VİZYON SERBEST (DÖVİZ) ÖZEL FON","19,277829","1.047.325,00","2","20.190.152,10"
"30.12.2022","FYA","İSTANBUL PORTFÖY ARK II SERBEST FON","0,010526","66.559.197.016,00","171","700.619.587,21"
"30.12.2022","FYB","AZİMUT PYŞ EB SERBEST ( DÖVİZ ) ÖZEL FON","22,939428","2.679.339,00","0","61.462.504,70"
"30.12.2022","FYD","QNB FINANS PORTFÖY BIRINCI HISSE SENEDI FONU (HISSE SENEDI YOĞUN FON)","3,541153","505.098.568,08","0","1.788.631.538,08"
"30.12.2022","FYF","STRATEJİ PORTFÖY MUTLAK GETİRİ HEDEFLİ HİSSE SENEDİ SERBEST FON(HİSSE SENEDİ YOĞUN)","0,032191","340.948.582,00","0","10.975.446,74"
"30.12.2022","FYG","AZİMUT PORTFÖY ÖPY SERBEST ( DÖVİZ ) ÖZEL FON","4,888446","120.818.095,00","0","590.612.765,64"
"30.12.2022","FYH","AZİMUT PYŞ SERBEST ( DÖVİZ ) FON","23,917048","6.125.328,00","0","146.499.765,43"
"30.12.2022","FYI","AZİMUT PORTFÖY 4.0 SERBEST FON","2,712413","29.551.938,00","0","80.157.052,26"
"30.12.2022","FYJ","AZİMUT PORTFÖY 19.0 SERBEST (DÖVİZ) FON","0,000000","0,00","0","0,00"
"30.12.2022","FYM","AZİMUT PORTFÖY ÜÇÜNCÜ SERBEST (DÖVİZ) FON","0,116321","747.572.816,00","0","86.958.136,95"
"30.12.2022","FYO","QNB FINANS PORTFÖY ÖZEL SEKTÖR BORÇLANMA ARAÇLARI FONU","0,302996","1.148.916.801,01","1.152","348.116.823,16"
"30.12.2022","FYT","QNB FİNANS PORTFÖY KISA VADELİ BORÇLANMA ARAÇLARI (TL) FONU","0,103142","11.315.596.916,47","101.952","1.167.115.428,81"
"30.12.2022","FYV","AZİMUT PORTFÖY PRO SERBEST (TL) ÖZEL FON","1,080947","40.200.000,00","0","43.454.088,04"
"30.12.2022","FYZ","AZİMUT PORTFÖY AS SERBEST ÖZEL FON","1,876753","60.000.000,00","0","112.605.165,67"
"30.12.2022","FZJ","FİBA PORTFÖY BİRİNCİ FON SEPETİ FONU","1,416176","764.369.236,00","3.280","1.082.481.281,58"
"30.12.2022","FZP","FİBA PORTFÖY SERBEST FON","1,566943","240.341.853,00","412","376.601.990,76"
"30.12.2022","GAC","GARANTİ PORTFÖY YİRMİBİRİNCİ SERBEST (DÖVİZ) ÖZEL FON","19,295935","6.004.984,00","1","115.871.782,14"
"30.12.2022","GAE","GARANTİ PORTFÖY BİST30 ENDEKSİ HİSSE SENEDİ (TL) FONU (HİSSE SENEDİ YOĞUN FON)","0,155555","4.521.636.282,00","10.267","703.363.549,19"
"30.12.2022","GAF","INVEO PORTFÖY BİRİNCİ HİSSE SENEDİ FONU (HİSSE SENEDİ YOĞUN FON)","0,412841","150.195.101,00","259","62.006.672,79"
"30.12.2022","GAG","INVEO PORTFÖY BİRİNCİ SERBEST (DÖVIZ)  FON","6,125871","8.604.422,00","30","52.709.575,31"
"30.12.2022","GAH","GARANTİ PORTFÖY MUTLAK GETİRİ HEDEFLİ DEĞİŞKEN FON","2,896603","33.354.971,00","677","96.616.118,73"
"30.12.2022","GAJ","GARANTİ PORTFÖY YİRMİÜÇÜNCÜ SERBEST (DÖVİZ) ÖZEL FON","19,380379","4.827.363,00","1","93.556.123,16"
"30.12.2022","GAK","INVEO PORTFÖY KARMA FON","2,459315","19.598.430,00","195","48.198.719,98"
"30.12.2022","GAL","GARANTİ PORTFÖY İKİNCİ PARA PİYASASI (TL) FONU","100,703779","53.684.314,00","20.035","5.406.213.292,88"
"30.12.2022","GAN","INVEO PORTFÖY ALFON SERBEST FON","12,929518","10.196.026,00","3","131.829.696,74"
"30.12.2022","GAS","GARANTİ PORTFÖY ÜÇÜNCÜ SERBEST(DÖVİZ) FON","0,102386","8.844.495.214,00","547","905.549.837,56"
"30.12.2022","GAU","GARANTİ PORTFÖY YİRMİNCİ SERBEST (DÖVİZ) ÖZEL FON","18,183243","19.851.161,00","4","360.958.484,98"
"30.12.2022","GAV","GARANTİ PORTFÖY YİRMİİKİNCİ SERBEST (DÖVİZ) ÖZEL FON","19,319637","998.596,00","1","19.292.512,30"
"30.12.2022","GA1","GARANTİ PORTFÖY  BORÇLANMA ARAÇLARI FONU","595,581509","380.373,00","905","226.543.125,38"
"30.12.2022","GBC","AZİMUT PYŞ YABANCI BYF FON SEPETİ FONU","0,081627","12.415.445.553,48","77","1.013.432.953,19"
"30.12.2022","GBG","INVEO PORTFÖY G-20 ÜLKELERİ YABANCI HİSSE SENEDİ FONU","0,130311","415.736.000,00","2.842","54.174.817,74"
"30.12.2022","GBL","AZİMUT PYŞ KISA VADELİ BORÇLANMA ARAÇLARI FONU","0,207423","4.235.840.381,35","1.290","878.610.054,59"
"30.12.2022","GBN","GARANTİ PORTFÖY BEŞİNCİ (TL) SERBEST FON","1,605189","626.019.059,00","50","1.004.879.076,21"
"30.12.2022","GBP","GARANTİ PORTFÖY YİRMİALTINCI SERBEST (DÖVİZ-AVRO) ÖZEL FON","20,394779","20.012.900,00","2","408.158.662,71"
"30.12.2022","GBV","GARANTİ PORTFÖY BLOCKCHAİN TEKNOLOJİLERİ DEĞİŞKEN FON","1,707460","48.949.108,00","1.779","83.578.667,50"
"30.12.2022","GBZ","AZİMUT PORTFÖY EMTİA FON SEPETİ FONU","0,966935","142.902.524,00","0","138.177.441,39"
"30.12.2022","GCA","GARANTİ PORTFÖY HM SERBEST (DÖVİZ) ÖZEL FON","20,341728","11.439.313,00","2","232.695.395,30"
"30.12.2022","GCC","GARANTİ PORTFÖY YİRMİSEKİZİNCİ SERBEST ÖZEL FON","0,000000","0,00","0","0,00"
"30.12.2022","GCD","ATLAS PORTFÖY UFUK SERBEST FON","3,835919","75.507.541,00","0","289.640.793,72"
"30.12.2022","GCG","GARANTİ PORTFÖY YİRMİYEDİNCİ SERBEST (TL) ÖZEL FON","0,000000","0,00","0","0,00"
"30.12.2022","GCI","GARANTİ PORTFÖY KARŞIYAKA SERBEST (DÖVİZ) ÖZEL FON","19,638339","3.600.000,00","3","70.698.021,40"
"30.12.2022","GCZ","GARANTİ PORTFÖY ZM SERBEST (DÖVİZ) ÖZEL FON","19,592918","7.911.831,00","1","155.015.855,92"
"30.12.2022","GDH","GARANTİ PORTFÖY BİRİNCİ FON SEPETİ ÖZEL FONU","0,000000","0,00","0","0,00"
"30.12.2022","GDL","GARANTİ PORTFÖY BİRİNCİ PARA PİYASASI ÖZEL FON","0,000000","0,00","0","0,01"
"30.12.2022","GEC","GARANTİ PORTFÖY SOYKAN SERBEST (DÖVİZ) ÖZEL FON","21,918861","4.627.726,00","3","101.434.482,85"
"30.12.2022","GEI","INVEO PORTFÖY EVEREST SERBEST FON","5,277064","28.048.345,00","7","148.012.925,00"
"30.12.2022","GFA","GARANTİ PORTFÖY OCAK 2024 SERBEST (DÖVİZ-ABD DOLARI) FON","19,240542","6.004.134,00","30","115.522.790,72"
"30.12.2022","GFB","GARANTİ PORTFÖY MISIRLI SERBEST (DÖVİZ) ÖZEL FON","19,917928","7.967.308,00","4","158.692.270,59"
"30.12.2022","GFD","GARANTİ PORTFÖY BAL SERBEST (DÖVİZ) ÖZEL FON","18,964591","4.293.887,00","4","81.431.811,89"
"30.12.2022","GFE","GARANTİ PORTFÖY ŞUBAT 2025 SERBEST (DÖVİZ-ABD DOLARI) FON","19,998157","3.534.266,00","11","70.678.805,84"
"30.12.2022","GFK","GARANTİ PORTFÖY AĞUSTOS 2024 SERBEST (DÖVİZ-ABD DOLARI) FON","19,622436","4.180.360,00","17","82.028.847,65"
"30.12.2022","GFL","GARANTİ PORTFÖY MİA SERBEST ÖZEL FON","1,368221","50.019.434,00","1","68.437.636,91"
"30.12.2022","GFN","GARANTİ PORTFÖY DAPEİ SERBEST  (DÖVİZ) ÖZEL FON","20,295221","10.455.462,00","3","212.195.908,66"
"30.12.2022","GFO","GARANTİ PORTFÖY HAZİRAN 2025 SERBEST (DÖVİZ-AVRO) FON","20,854206","3.166.318,00","20","66.031.047,45"
"30.12.2022","GFT","AZİMUT PORTFÖY HE SERBEST (TL) ÖZEL FON","1,888681","27.853.198,00","0","52.605.794,03"
"30.12.2022","GFY","GARANTİ PORTFÖY OL SERBEST (DÖVİZ) ÖZEL FON","18,228362","9.901.181,00","3","180.482.313,03"
"30.12.2022","GGB","GARANTİ PORTFÖY ARK SERBEST (DÖVİZ) ÖZEL FON","0,000000","0,00","0","0,00"
"30.12.2022","GGC","AK PORTFÖY KIYI SERBEST ÖZEL FON","1,702020","83.054.437,00","5","141.360.293,35"
"30.12.2022","GGK","INVEO PORTFÖY  ALTIN FON","2,247071","20.616.200,00","214","46.326.069,32"
"30.12.2022","GGL","ÜNLÜ PORTFÖY YEDİNCİ SERBEST ÖZEL FON","3,099380","37.917.246,00","1","117.519.945,98"
"30.12.2022","GGM","GARANTİ PORTFÖY GMS SERBEST ÖZEL FON","1,798233","342.290.935,00","1","615.518.907,57"
"30.12.2022","GGN","GARANTİ PORTFÖY AYDOĞAN SERBEST(DÖVİZ) ÖZEL FON","19,692178","4.821.286,00","2","94.941.623,64"
"30.12.2022","GGP","GARANTİ PORTFÖY ALTINCI SERBEST (DÖVİZ) ÖZEL FON","19,457983","7.265.534,00","1","141.372.635,53"
"30.12.2022","GGR","GARANTİ PORTFÖY ONİKİNCİ SERBEST (DÖVİZ) ÖZEL FON","20,287058","27.921.441,00","3","566.443.891,57"
"30.12.2022","GGZ","GARANTİ PORTFÖY ONBİRİNCİ SERBEST FON","0,000000","0,00","0","0,01"
"30.12.2022","GHS","GARANTİ PORTFÖY HİSSE SENEDİ (TL) FONU (HİSSE SENEDİ YOĞUN FON)","11,005316","176.598.994,00","8.702","1.943.527.669,84"
"30.12.2022","GIE","GARANTİ PORTFÖY GARANTİ BBVA İKLİM ENDEKSİ HİSSE SENEDİ (TL) FONU (HİSSE SENEDİ YOĞUN FON)","0,000000","0,00","0","0,00"
"30.12.2022","GJA","GARANTİ PORTFÖY ONYEDİNCİ SERBEST (DÖVİZ) ÖZEL FON","19,320178","8.775.687,00","2","169.547.831,11"
"30.12.2022","GJB","INVEO PORTFÖY BİRİNCİ FON SEPETİ FONU","2,483038","30.812.407,00","164","76.508.389,23"
"30.12.2022","GJD","GARANTİ PORTFÖY ORTAS SERBEST (DÖVİZ) ÖZEL FON","18,399172","8.630.470,00","3","158.793.501,99"
"30.12.2022","GJE","GARANTİ PORTFÖY ECZ SERBEST (DÖVİZ) ÖZEL FON","19,394847","16.251.655,00","8","315.198.361,89"
"30.12.2022","GJF","GARANTİ PORTFÖY BEREKET SERBEST (DÖVİZ) ÖZEL FON","19,056521","5.228.837,00","2","99.643.441,08"
"30.12.2022","GJH","GARANTİ PORTFÖY KISA VADELİ  SERBEST (TL) FON","0,000000","0,00","0","0,00"
"30.12.2022","GJM","GLOBAL MD PORTFÖY ADA SERBEST FON","7,230022","18.000.000,00","0","130.140.393,23"
"30.12.2022","GJO","GARANTİ PORTFÖY ONALTINCI SERBEST (DÖVİZ) ÖZEL FON","19,031849","5.126.345,00","1","97.563.825,13"
"30.12.2022","GJP","GARANTİ PORTFÖY ONBEŞİNCİ SERBEST ÖZEL FON","0,000000","0,00","0","0,01"
"30.12.2022","GKF","GLOBAL MD PORTFÖY KATILIM FONU","1,161601","116.806,00","0","135.681,96"
"30.12.2022","GKH","GARANTİ PORTFÖY  KATILIM SERBEST (TL) FON","1,084313","9.538.491,00","11","10.342.707,41"
"30.12.2022","GKK","GARANTİ PORTFÖY ONDÖRDÜNCÜ SERBEST (DÖVİZ) ÖZEL FON","18,971481","18.585.432,00","2","352.593.171,89"
"30.12.2022","GKL","GARANTİ PORTFÖY YF HİSSE SENEDİ SERBEST ÖZEL FON (HİSSE SENEDİ YOĞUN FON)","4,028802","56.249.207,00","4","226.616.912,97"
"30.12.2022","GKS","INVEO PORTFÖY İKİNCİ SERBEST FON","2,767651","28.260.238,00","4","78.214.464,19"
"30.12.2022","GKV","GARANTİ PORTFÖY KATILIM HİSSE SENEDİ (TL) FONU (HİSSE SENEDİ YOĞUN FON)","2,373086","86.062.212,00","1.066","204.233.063,88"
"30.12.2022","GLC","GLOBAL MD PORTFÖY İKİNCİ FON SEPETİ FONU","1,512921","1.781.850,00","0","2.695.798,52"
"30.12.2022","GLG","GLOBAL MD PORTFÖY CAPİTAL HİSSE SENEDİ SERBEST FON (HİSSE SENEDİ YOĞUN FON)","2,118688","8.089.969,00","0","17.140.123,81"
"30.12.2022","GLM","ATLAS PORTFÖY ÜÇÜNCÜ SERBEST (TL) FON","1,337977","55.820.814,00","0","74.686.940,01"
"30.12.2022","GLN","GARANTİ PORTFÖY EREN SERBEST (DÖVİZ) ÖZEL FON","0,000000","0,00","0","0,01"
"30.12.2022","GLP","GARANTİ PORTFÖY PRUVA SERBEST (DÖVİZ) ÖZEL FON","17,680030","8.849.317,00","4","156.456.191,43"
"30.12.2022","GLS","AZİMUT PORTFÖY  KİRA SERTİFİKALARI (SUKUK) KATILIM FONU","0,045111","486.213.927,00","139","21.933.695,25"
"30.12.2022","GLV","GLOBAL MD PORTFÖY NEHİR SERBEST FON","2,710138","6.500.000,00","0","17.615.899,93"
"30.12.2022","GLZ","GARANTİ PORTFÖY İKİNCİ PARA PİYASASI ÖZEL FONU","0,000000","0,00","0","0,01"
"30.12.2022","GL1","AZİMUT PYŞ BİRİNCİ HİSSE SENEDİ FONU (HİSSE SENEDİ YOĞUN FON)","399,243415","3.640.323,00","104","1.453.374.985,43"
"30.12.2022","GMA","AZİMUT PORTFÖY ÇOKLU VARLIK DEĞİŞKEN FON","0,549465","5.129.619.871,56","212","2.818.544.325,08"
"30.12.2022","GMC","TEB PORTFÖY GÜMÜŞ FON SEPETİ FONU","1,238840","97.624.930,00","1.717","120.941.688,70"
"30.12.2022","GMD","GLOBAL MD PORTFÖY BİRİNCİ FON SEPETİ FONU","1,382571","1.231.470,00","0","1.702.594,32"
"30.12.2022","GME","INVEO PORTFÖY EGE SERBEST ÖZEL FON","6,512303","14.109.435,13","2","91.884.919,59"
"30.12.2022","GMG","GARANTİ PORTFÖY MART 2024 SERBEST (DÖVİZ-ABD DOLARI) FON","19,249668","97.284.415,00","443","1.872.692.723,53"
"30.12.2022","GMJ","GARANTİ PORTFÖY MART 2023 SERBEST (DÖVİZ-ABD DOLARI) FON","19,363511","129.570.821,00","570","2.508.946.009,10"
"30.12.2022","GMP","GARANTİ PORTFÖY GM SERBEST (DÖVİZ) ÖZEL FON","17,178374","39.276.458,00","1","674.705.680,68"
"30.12.2022","GMR","INVEO PORTFÖY İKİNCİ HİSSE SENEDİ FONU (HİSSE SENEDİ YOĞUN FON)","0,486711","468.627.400,00","1.071","228.085.982,40"
"30.12.2022","GMV","GARANTİ PORTFÖY OCAK 2026 SERBEST (DÖVİZ-ABD DOLARI) FON","20,467625","6.136.992,00","14","125.609.650,69"
"30.12.2022","GMZ","INVEO PORTFÖY MZ SERBEST ÖZEL FON","4,187727","23.505.763,79","1","98.435.724,30"
"30.12.2022","GNK","AZİMUT PORTFÖY SARPAY SERBEST (DÖVİZ) ÖZEL FON","19,985816","4.281.000,00","0","85.559.279,97"
"30.12.2022","GOH","GARANTİ PORTFÖY BIST 100 DIŞI ŞİRKETLER HİSSE SENEDİ (TL) FONU (HİSSE SENEDİ YOĞUN FON)","5,019175","620.718.475,00","13.694","3.115.494.808,15"
"30.12.2022","GO1","GRİ PORTFÖY BİRİNCİ FON SEPETİ FONU","1,073075","829.312,00","0","889.913,69"
"30.12.2022","GO2","GRİ PORTFÖY İKİNCİ FON SEPETİ FONU","1,124277","1.876.546,00","0","2.109.757,09"
"30.12.2022","GO3","GRİ PORTFÖY ÜÇÜNCÜ FON SEPETİ FONU","1,131652","3.380.016,00","0","3.825.002,85"
"30.12.2022","GO4","GRİ PORTFÖY DÖRDÜNCÜ FON SEPETİ FONU","1,145903","2.120.123,00","0","2.429.454,47"
"30.12.2022","GPA","GARANTİ PORTFÖY EUROBOND BORÇLANMA ARAÇLARI (DÖVİZ) FONU","6,687978","150.971.051,00","5.090","1.009.691.026,28"
"30.12.2022","GPB","GARANTİ PORTFÖY BİRİNCİ DEĞİŞKEN FON","3,236915","237.756.025,00","13.184","769.595.929,88"
"30.12.2022","GPC","GARANTİ PORTFÖY İKİNCİ SERBEST ( DÖVİZ ) FON","20,903092","16.546.257,00","200","345.867.932,76"
"30.12.2022","GPF","GARANTİ PORTFÖY BİRİNCİ KATILIM FONU","2,603748","94.930.548,00","825","247.175.178,67"
"30.12.2022","GPG","INVEO PORTFÖY BİRİNCİ DEĞİŞKEN FON","3,572015","58.178.600,00","811","207.814.851,91"
"30.12.2022","GPH","GARANTİ PORTFÖY ONSEKİZİNCİ SERBEST (DÖVİZ) ÖZEL FON","19,812999","6.000.000,00","1","118.877.995,28"
"30.12.2022","GPI","GARANTİ PORTFÖY İKİNCİ DEĞİŞKEN FON","4,252590","100.818.356,00","3.555","428.739.172,41"
"30.12.2022","GPL","GARANTİ PORTFÖY BİRİNCİ SERBEST (DÖVİZ) FON","18,737048","536.380.180,00","4.303","10.050.181.229,03"
"30.12.2022","GPU","GARANTİ PORTFÖY ÜÇÜNCÜ DEĞİŞKEN FON","4,852956","40.009.268,00","2.735","194.163.213,71"
"30.12.2022","GPV","GARANTİ PORTFÖY ONDOKUZUNCU SERBEST (DÖVİZ) ÖZEL FON","19,862924","4.857.916,00","1","96.492.418,61"
"30.12.2022","GPZ","GARANTİ PORTFÖY ÜÇÜNCÜ PARA PİYASASI FONU","1,294574","698.567.532,00","110","904.347.377,45"
"30.12.2022","GP1","AZİMUT PORTFÖY AEB SERBEST (TL) ÖZEL FON","1,012984","62.247.020,00","0","63.055.256,95"
"30.12.2022","GSE","AZİMUT PORTFÖY 7.0 SERBEST (DÖVİZ) FON","20,749424","44.418.395,00","0","921.656.096,33"
"30.12.2022","GSG","AZİMUT PORTFÖY GÜREL SERBEST (DÖVİZ) ÖZEL FON","20,439016","1.710.679,00","0","34.964.596,12"
"30.12.2022","GSM","INVEO PORTFÖY SİLVER CAPİTAL SERBEST ÖZEL FON","1,782757","47.218.603,00","1","84.179.279,09"
"30.12.2022","GSO","GARANTİ PORTFÖY ÖPY SERBEST ÖZEL FON","3,138183","18.371.353,00","6","57.652.668,28"
"30.12.2022","GSP","AZİMUT PYŞ KAR PAYI ÖDEYEN HİSSE SENEDİ FONU (HİSSE SENEDİ YOĞUN FON)","0,137015","10.675.046.722,00","277","1.462.638.168,58"
"30.12.2022","GSS","GARANTİ PORTFÖY INN SERBEST (DÖVİZ) ÖZEL FON","0,000000","0,00","0","0,00"
"30.12.2022","GTA","GARANTİ PORTFÖY ALTIN FONU","0,297756","6.887.556.600,00","19.280","2.050.809.845,39"
"30.12.2022","GTF","AZİMUT PYŞ BİRİNCİ BORÇLANMA ARAÇLARI FONU","4,448728","48.306.070,96","278","214.900.557,88"
"30.12.2022","GTK","GARANTİ PORTFÖY KAMU BORÇLANMA ARAÇLARI ÖZEL FONU","2,412860","3.116.233.608,00","1","7.519.036.212,90"
"30.12.2022","GTL","GARANTİ PORTFÖY BİRİNCİ PARA PİYASASI (TL) FONU","0,032815","275.084.699.495,00","90.315","9.026.817.984,15"
"30.12.2022","GTM","GARANTİ PORTFÖY TEMETTÜ ÖDEYEN ŞİRKETLER HİSSE SENEDİ (TL) FONU (HİSSE SENEDİ YOĞUN FON)","1,879120","68.734.329,00","1.665","129.160.038,85"
"30.12.2022","GTY","GARANTİ PORTFÖY TREND SERBEST FON","1,615211","65.454.024,00","100","105.722.079,17"
"30.12.2022","GTZ","GARANTİ PORTFÖY GÜMÜŞ FON SEPETİ FONU","1,960429","262.619.502,00","7.267","514.846.910,59"
"30.12.2022","GUA","GARANTİ  PORTFÖY BİRİNCİ BORÇLANMA ARAÇLARI ÖZEL FON","1,493315","314.819.131,00","1","470.124.094,67"
"30.12.2022","GUE","GARANTİ PORTFÖY ÖPY PARA PİYASASI (TL) ÖZEL FON","1,386298","4.450.000,00","1","6.169.027,23"
"30.12.2022","GUH","GARANTI PORTFÖY YABANCI TEKNOLOJİ BYF FON SEPETİ FONU","0,071891","7.433.861.272,00","9.727","534.429.289,20"
"30.12.2022","GUM","AK PORTFÖY GÜMÜŞ FON SEPETI FONU","2,116131","220.019.908,00","7.637","465.590.888,29"
"30.12.2022","GVA","GARANTİ PORTFÖY ELEKTRİKLİ VE OTONOM ARAÇLAR DEĞİŞKEN FON","1,147700","29.205.866,00","1.394","33.519.563,86"
"30.12.2022","GVB","GARANTİ PORTFÖY ACE SERBEST (DÖVİZ-ABD DOLARI) ÖZEL FON","19,869891","7.049.613,00","1","140.075.038,64"
"30.12.2022","GVC","GARANTİ PORTFÖY ERG SERBEST (DÖVİZ) ÖZEL FON","19,322886","4.926.270,00","1","95.189.753,90"
"30.12.2022","GVD","GARANTİ PORTFÖY KARABAĞLI SERBEST (DÖVİZ) ÖZEL FON","19,714119","5.044.047,00","1","99.438.942,55"
"30.12.2022","GVI","GARANTİ PORTFÖY ÜÇÜNCÜ FON SEPETİ FONU","1,401794","34.819.876,00","288","48.810.309,33"
"30.12.2022","GVL","GARANTİ  PORTFÖY ZYT SERBEST (DÖVİZ) ÖZEL FON","18,968068","11.469.326,00","2","217.550.959,71"
"30.12.2022","GVY","GARANTİ PORTFÖY YİRMİDOKUZUNCU SERBEST (TL) ÖZEL FON","1,002962","50.033.671,00","2","50.181.850,05"
"30.12.2022","GVZ","GARANTİ PORTFÖY ACE SERBEST (DÖVİZ-AVRO) ÖZEL FON","21,342259","5.769.476,00","1","123.133.650,10"
"30.12.2022","GYC","GARANTİ PORTFÖY YİRMİBEŞİNCİ SERBEST ÖZEL FON","1,081939","1.980.540.637,00","1","2.142.823.169,35"
"30.12.2022","GYG","GARANTİ PORTFÖY TEKOS SERBEST (DÖVİZ-AVRO) ÖZEL FON","20,167016","5.000.000,00","5","100.835.079,19"
"30.12.2022","GYK","INVEO PORTFÖY BORÇLANMA ARAÇLARI (TL) FONU","0,029500","2.072.565.114,00","87","61.141.070,48"
"30.12.2022","GYL","INVEO PORTFÖY KISA VADELİ BORÇLANMA ARAÇLARI (TL) FONU","3,993346","79.041.307,00","16.452","315.639.263,20"
"30.12.2022","GYN","GARANTİ PORTFÖY HCR SERBEST (DÖVİZ) ÖZEL FON","19,339313","20.595.320,00","1","398.299.338,88"
"30.12.2022","GYR","GARANTİ PORTFÖY TEKOS SERBEST (DÖVİZ-ABD DOLARI) ÖZEL FON","19,007348","11.570.000,00","5","219.915.014,37"
"30.12.2022","GZB","GARANTİ PORTFÖY ÖPY İKİNCİ SERBEST ÖZEL FON","1,611937","144.735.765,00","1","233.304.864,62"
"30.12.2022","GZD","GARANTİ PORTFÖY ONÜCÜNCÜ SERBEST (DÖVİZ) ÖZEL FON","20,029735","4.064.452,00","2","81.409.896,95"
"30.12.2022","GZE","GARANTİ PORTFÖY EMTİA SERBEST FON","2,279297","92.869.259,00","1.511","211.676.612,94"
"30.12.2022","GZG","GARANTİ PORTFÖY SAĞLIK SEKTÖRÜ DEĞİŞKEN FON","2,200236","28.316.382,00","1.166","62.302.719,38"
"30.12.2022","GZH","GARANTİ PORTFÖY TEMİZ ENERJİ DEĞİŞKEN FON","2,003786","106.613.857,00","3.351","213.631.319,09"
"30.12.2022","GZJ","GARANTİ PORTFÖY İKİNCİ FON SEPETİ FONU","2,081983","173.649.608,00","1.102","361.535.545,99"
"30.12.2022","GZL","GARANTİ PORTFÖY TARIM VE GIDA SEKTÖRÜ DEĞİŞKEN FON","2,184934","227.335.228,00","5.246","496.712.479,59"
"30.12.2022","GZM","GLOBAL MD PORTFÖY DİNAMİK SERBEST FON","4,600805","3.732.125,00","0","17.170.779,22"
"30.12.2022","GZN","GLOBAL MD PORTFÖY BOĞAZİÇİ SERBEST FON","9,743314","38.758.993,00","0","377.641.055,22"
"30.12.2022","GZO","GARANTİ PORTFÖY ÖZM SERBEST (DÖVİZ) ÖZEL FON","19,683239","4.864.974,00","1","95.758.447,12"
"30.12.2022","GZP","GARANTİ PORTFÖY BİRİNCİ FON SEPETİ FONU","1,782151","356.090.839,00","942","634.607.609,45"
"30.12.2022","GZR","GARANTİ PORTFÖY SÜRDÜRÜLEBİLİRLİK HİSSE SENEDİ (TL) FONU (HİSSE SENEDİ YOĞUN FON)","3,579555","84.563.901,00","2.589","302.701.103,39"
"30.12.2022","GZU","GARANTİ PORTFÖY EKE SERBEST (DÖVİZ) ÖZEL FON","18,981724","4.000.000,00","2","75.926.895,88"
"30.12.2022","GZV","GARANTİ PORTFÖY ESG SÜRDÜRÜLEBİLİRLİK FON SEPETİ FONU","2,257354","34.132.769,00","1.308","77.049.731,71"
"30.12.2022","GZY","GARANTİ PORTFÖY TURİZM VE SEYAHAT SEKTÖRÜ DEĞİŞKEN FON","1,948459","22.784.798,00","1.035","44.395.254,14"
"30.12.2022","GZZ","GARANTİ PORTFÖY FİNANS SEKTÖRÜ DEĞİŞKEN FON","1,731762","4.948.968,00","262","8.570.434,77"
"30.12.2022","HAE","HSBC PORTFÖY AĞUSTOS 2024 SERBEST (DÖVİZ) FON","18,631875","843.153,00","16","15.709.521,43"
"30.12.2022","HAG","GARANTİ PORTFÖY 2022 SERBEST (DÖVİZ-ABD DOLARI) FON","0,000000","0,00","0","0,01"
"30.12.2022","HBF","HSBC PORTFÖY ALTIN FONU","8,694109","36.548.223,00","4.105","317.754.222,48"
"30.12.2022","HBN","HSBC PORTFÖY BİRİNCİ FON SEPETİ FONU","1,129795","528.638.485,00","2.184","597.252.931,09"
"30.12.2022","HBU","HSBC PORTFÖY BİST 30 ENDEKSİ HİSSE SENEDİ FONU (HİSSE SENEDİ YOĞUN FON)","0,481694","260.101.800,00","3.563","125.289.402,32"
"30.12.2022","HBV","HEDEF PORTFÖY DORUK SERBEST FON","1,556150","91.774,00","11","142.814,08"
"30.12.2022","HDB","HSBC PORTFÖY BİRİNCİ SERBEST (DÖVİZ) FON","20,901016","55.282.460,00","613","1.155.459.581,95"
"30.12.2022","HDH","HEDEF PORTFÖY DOĞU HİSSE SENEDİ SERBEST (TL) FON (HİSSE SENEDİ YOĞUN FON)","250,805197","3.673.095,00","15","921.231.313,61"
"30.12.2022","HDJ","HEDEF PORTFÖY ARTI SERBEST (TL) FON","1,333416","77.009.066,00","23","102.685.122,14"
"30.12.2022","HDS","HEDEF PORTFÖY SERBEST (TL) FON","3,757530","98.633.614,00","7","370.618.729,74"
