"30.12.2022","HEH","HEDEF PORTFÖY ALGO EVEREST İSTATİSTİKSEL ARBİTRAJ HİSSE SENEDİ SERBEST (TL) FON (HİSSE SENEDİ YOĞUN FON)","0,000000","0,00","0","0,00"
"30.12.2022","HFF","GARANTİ PORTFÖY NİSAN 2022 SERBEST (DÖVİZ-ABD DOLARI) FON","0,000000","0,00","0","0,01"
"30.12.2022","HFV","HSBC PYŞ ÜÇÜNCÜ SERBEST (DÖVİZ) FON","19,066178","6.637.623,00","196","126.554.101,45"
"30.12.2022","HGC","HSBC PYŞ İKİNCİ SERBEST (DÖVİZ) FON","19,357368","125.226.881,00","1.594","2.424.062.766,52"
"30.12.2022","HGH","HEDEF PORTFÖY GÜNEŞ HİSSE SENEDİ SERBEST (TL) FON (HİSSE SENEDİ YOĞUN FON)","1,280860","29.963.655,00","0","38.379.239,75"
"30.12.2022","HGT","AZİMUT PORTFÖY 15.0 SERBEST (DÖVİZ) FON","15,904434","12.723.309,00","0","202.357.031,14"
"30.12.2022","HGU","HSBC PORTFÖY GÜÇLÜ SERBEST ÖZEL FON","1,000172","100.000.000,00","0","100.017.232,70"
"30.12.2022","HGV","HEDEF PORTFÖY SENTİMENT SERBEST FON","1,301190","16.921.982,00","4","22.018.721,82"
"30.12.2022","HII","HSBC PYŞ BİRİNCİ SERBEST (DÖVİZ) ÖZEL FON","0,972122","386.059.910,00","1","375.297.379,64"
"30.12.2022","HJA","AZİMUT PORTFÖY BİRİNCİ HİSSE SENEDİ SERBEST FON (HİSSE SENEDİ YOĞUN FON)","3,150641","30.593.012,00","0","96.387.597,65"
"30.12.2022","HJB","HEDEF PORTFÖY BİRİNCİ DEĞİŞKEN FON","0,000000","0,00","0","0,00"
"30.12.2022","HKH","HEDEF PORTFÖY KATILIM HİSSE SENEDİ (TL) FONU (HİSSE SENEDİ YOĞUN FON)","2,438395","444.644.969,00","0","1.084.220.000,05"
"30.12.2022","HKR","HSBC PORTFÖY KIRMIZI HİSSE SENEDİ SERBEST (TL) FON (HİSSE SENEDİ YOĞUN FON)","1,014653","38.105.907,00","137","38.664.261,74"
"30.12.2022","HKV","ZİRAAT PORTFÖY HALKBANK KISA VADELİ BORÇLANMA ARAÇLARI (TL) FONU","157,243347","6.478.603,00","1","1.018.717.220,49"
"30.12.2022","HLL","ZİRAAT PORTFÖY HALKBANK PARA PİYASASI (TL) FONU","0,092176","60.977.845.894,00","1","5.620.718.894,35"
"30.12.2022","HLR","HEDEF PORTFÖY ADA HİSSE SENEDİ SERBEST (TL) FON (HİSSE SENEDİ YOĞUN FON)","5,602427","49.277.524,00","13","276.073.706,67"
"30.12.2022","HMC","HEDEF PORTFÖY EKİNOKS SERBEST FON","2,803858","18.773.853,00","66","52.639.213,15"
"30.12.2022","HME","HSBC PORTFÖY MART 2023 SERBEST (DÖVİZ) FON","18,666336","36.767.810,00","803","686.320.277,50"
"30.12.2022","HMG","HSBC PYŞ MUTLAK GETİRİ HEDEFLİ HİSSE SENEDİ SERBEST (TL) FON(HİSSE SENEDİ YOĞUN FON)","0,017566","22.866.660.936,00","590","401.665.367,22"
"30.12.2022","HMK","HEDEF PORTFÖY EGE HİSSE SENEDİ SERBEST FON(HİSSE SENEDİ YOĞUN FON)","95,922510","12.304.414,00","92","1.180.270.269,91"
"30.12.2022","HMR","HEDEF PORTFÖY KISA VADELİ BORÇLANMA ARAÇLARI FONU","0,000000","0,00","0","0,00"
"30.12.2022","HMS","HSBC PORTFÖY SÜRDÜRÜLEBİLİRLİK HİSSE SENEDİ (TL) FONU (HİSSE SENEDİ YOĞUN FON)","0,029654","6.997.995.158,00","1.676","207.518.528,34"
"30.12.2022","HMT","AZİMUT PORTFÖY 12.0 SERBEST FON","1,994649","15.533.958,00","0","30.984.792,86"
"30.12.2022","HMV","HEDEF PORTFÖY MAVİ HİSSE SENEDİ SERBEST FON (HİSSE SENEDİ YOĞUN FON)","5,324818","25.056.452,00","2","133.421.035,92"
"30.12.2022","HNN","GARANTİ PORTFÖY OCAK 2023 SERBEST(DÖVİZ-ABD DOLARI) FON","19,715484","114.608.977,00","534","2.259.571.451,30"
"30.12.2022","HNS","HSBC PORTFÖY NİSAN 2024 SERBEST (DÖVİZ) FON","18,602355","842.361,00","16","15.669.898,43"
"30.12.2022","HOA","HSBC PORTFÖY TEKNOLOJİ DEĞİŞKEN FON","0,038059","1.333.179.663,00","826","50.739.063,39"
"30.12.2022","HOY","HSBC PORTFÖY YABANCI BYF FON SEPETI","0,095865","7.081.392.802,00","3.067","678.854.706,40"
"30.12.2022","HPC","ZİRAAT PORTFÖY HEDEF SERBEST ÖZEL FON","2,788504","3.822.539.422,00","2","10.659.167.958,15"
"30.12.2022","HPD","HSBC PORTFÖY ÇOKLU VARLIK İKİNCİ DEĞİŞKEN FON","0,065819","2.825.369.734,00","1.674","185.963.367,31"
"30.12.2022","HPF","HEDEF PORTFÖY KUZEY HİSSE SENEDİ SERBEST (TL) FON (HİSSE SENEDİ YOĞUN FON)","23,135956","30.668.756,00","14","709.550.998,98"
"30.12.2022","HPI","HEDEF PORTFÖY İDEAL HİSSE SENEDİ SERBEST (TL) FON (HİSSE SENEDİ YOĞUN FON)","8,460798","109.389.508,00","14","925.522.561,64"
"30.12.2022","HPJ","AZİMUT PORTFÖY HP SERBEST ÖZEL FON","1,374961","56.018.477,00","0","77.023.248,80"
"30.12.2022","HPL","HEDEF PORTFÖY ÇINAR HİSSE SENEDİ SERBEST FON (HİSSE SENEDİ YOĞUN FON)","5,728722","13.108.707,00","9","75.096.134,06"
"30.12.2022","HPO","HSBC PORTFÖY ÇOKLU VARLIK BİRİNCİ DEĞİŞKEN FON","0,044601","12.231.455.972,20","3.149","545.532.666,52"
"30.12.2022","HPT","HSBC PORTFÖY KISA VADELİ BORÇLANMA ARAÇLARI (TL) FONU","0,031207","13.702.372.007,00","12.956","427.612.228,00"
"30.12.2022","HPV","ZİRAAT PORTFÖY HALKBANK KISA VADELİ KİRA SERTİFİKALARI KATILIM (TL) FONU","2,126757","648.712.572,00","1","1.379.653.947,16"
"30.12.2022","HPZ","HEDEF PORTFÖY ZEN HİSSE SENEDİ SERBEST (TL) FON (HİSSE SENEDİ YOĞUN)","149,811189","5.100.902,00","14","764.172.196,14"
"30.12.2022","HP3","HEDEF PORTFÖY LİDYA SERBEST (DÖVİZ) FON","0,000000","0,00","0","0,00"
"30.12.2022","HSA","HSBC PORTFÖY DEĞİŞKEN (TL) FON","486,503678","6.665.309,00","5.902","3.242.697.346,66"
"30.12.2022","HSL","HSBC PORTFÖY PARA PİYASASI (TL) FONU","103,884652","4.099.078,00","17.148","425.831.293,53"
"30.12.2022","HST","HSBC PORTFÖY  BORÇLANMA ARAÇLARI (TL) FONU","0,423133","64.463.918,33","1.806","27.276.828,61"
"30.12.2022","HTZ","HEDEF PORTFÖY TURKUAZ SERBEST (TL) FON","0,976526","8.591.232,00","0","8.389.565,13"
"30.12.2022","HUI","AZİMUT PORTFÖY CAN SERBEST ÖZEL FON","29,101646","23.951.986,00","0","697.042.222,17"
"30.12.2022","HVA","HEDEF PORTFÖY ECE HİSSE SENEDİ SERBEST FON (HİSSE SENEDİ YOĞUN FON)","1,270443","308.384,00","11","391.784,22"
"30.12.2022","HVB","HEDEF PORTFÖY PUSULA HİSSE SENEDİ SERBEST FON (HİSSE SENEDİ YOĞUN FON)","0,283182","655.980.613,00","15","185.761.697,82"
"30.12.2022","HVC","HEDEF PORTFÖY ROTA HİSSE SENEDİ SERBEST FON (HİSSE SENEDİ YOĞUN FON)","14,531002","4.488.088,00","10","65.216.415,43"
"30.12.2022","HVK","HEDEF PORTFÖY BİRİNCİ BORÇLANMA ARAÇLARI (TL) FONU","1,262381","319.503.328,00","184","403.334.950,67"
"30.12.2022","HVL","HEDEF PORTFÖY POYRAZ SERBEST FON","16,810066","18.755.063,00","7","315.273.843,11"
"30.12.2022","HVN","HEDEF PORTFÖY MUTLAK GETİRİ HEDEFLİ HİSSE SENEDİ SERBEST (TL) FON (HİSSE SENEDİ YOĞUN FON)","1,443252","200.058.045,00","0","288.734.216,79"
"30.12.2022","HVS","HSBC PORTFÖY HİSSE SENEDİ (TL) FONU (HİSSE SENEDİ YOĞUN FON)","0,445941","4.281.016.243,00","13.648","1.909.081.833,17"
"30.12.2022","HVT","ALLBATROSS PORTFÖY BİRİNCİ PARA PİYASASI (TL) FONU","1,053915","36.899.709,00","0","38.889.142,03"
"30.12.2022","HVU","ALLBATROSS PORTFÖY BİRİNCİ DEĞİŞKEN FON","1,406690","4.305.513,00","0","6.056.522,14"
"30.12.2022","HVV","AK PORTFÖY HERAKLES SERBEST (DÖVİZ) ÖZEL FON","21,255046","60.669.550,00","0","1.289.534.055,57"
"30.12.2022","HVZ","ALLBATROSS PORTFÖY BİRİNCİ HİSSE SENEDİ (TL) FONU (HİSSE SENEDİ YOĞUN FON)","2,037382","170.871.891,00","0","348.131.250,24"
"30.12.2022","HYK","HEDEF PORTFÖY AKDENİZ SERBEST FON","3,232948","32.873.243,00","45","106.277.472,31"
"30.12.2022","HYP","AZİMUT PORTFÖY İVME SERBEST FON","2,286335","80.436.190,00","0","183.904.099,13"
"30.12.2022","HYV","HEDEF PORTFÖY PARA PİYASASI (TL) FONU","1,440036","2.257.098.541,00","2.426","3.250.302.113,54"
"30.12.2022","HYY","AK PORTFÖY HERAKLES SERBEST ÖZEL FON","3,098427","369.151.130,00","1","1.143.787.850,36"
"30.12.2022","HZV","AK PORTFÖY HEZ SERBEST ÖZEL FON","1,437339","86.815.802,00","2","124.783.711,60"
"30.12.2022","IAC","İŞ PORTFÖY MZS SERBEST ÖZEL FON","2,851311","68.648.692,00","1","195.738.786,82"
"30.12.2022","IAF","İSTANBUL PORTFÖY ARK I SERBEST FON","0,238939","1.243.660.931,00","74","297.159.092,06"
"30.12.2022","IAI","İŞ PORTFÖY TOROS SERBEST ÖZEL FON","1,748226","55.012.790,00","1","96.174.797,62"
"30.12.2022","IAR","İSTANBUL PORTFÖY DÖRDÜNCÜ SERBEST FON","20,978987","15.677.350,00","35","328.894.918,28"
"30.12.2022","IAS","QİNVEST PORTFÖY MUTLAK GETİRİ HEDEFLİ HİSSE SENEDİ SERBEST FON(HİSSE SENEDİ YOĞUN FON)","0,295448","1.866.286.291,00","2","551.390.944,10"
"30.12.2022","IAT","İŞ PORTFÖY KİRA SERTİFİKALARI KATILIM (TL) FONU","0,058633","6.672.470.101,67","2.291","391.228.410,07"
"30.12.2022","IBB","İŞ PORTFÖY ATAK DEĞİŞKEN FON","3,938428","101.444.816,00","6.017","399.533.097,05"
"30.12.2022","IBC","İŞ PORTFÖY CENOVA SERBEST ÖZEL FON","4,365250","25.165.573,00","5","109.854.008,08"
"30.12.2022","IBD","İŞ PORTFÖY BAYRAKTARLAR HOLDİNG DEĞİŞKEN ÖZEL FON","0,277799","6.442.204.980,00","2","1.789.639.510,03"
"30.12.2022","IBE","İSTANBUL PORTFÖY BEŞİNCİ SERBEST FON","6,076528","78.234.089,00","5","475.391.667,38"
"30.12.2022","IBG","AZİMUT PYŞ BİRİNCİ SERBEST FON","0,249893","1.290.443.362,00","227","322.472.501,49"
"30.12.2022","IBJ","AZİMUT PORTFÖY 18.0 SERBEST (DÖVİZ) FON","18,117988","4.000.000,00","0","72.471.951,97"
"30.12.2022","IBK","İŞ PORTFÖY MAXİMUM KART KISA VADELİ BORÇLANMA ARAÇLARI (TL) FONU","0,034467","2.632.824.670,00","125.231","90.744.589,90"
"30.12.2022","IBM","İSTANBUL PORTFÖY MUTLAK GETİRİ HEDEFLİ SERBEST FON","0,000000","0,00","0","0,00"
"30.12.2022","IBP","İŞ PORTFÖY GED SERBEST (DÖVİZ) ÖZEL FON","19,491439","63.032.972,00","4","1.228.603.311,90"
"30.12.2022","IBR","AZİMUT PYŞ MUTLAK GETİRİ HEDEFLİ SERBEST FON","0,068878","1.203.729.998,00","105","82.910.879,16"
"30.12.2022","ICA","ICBC TURKEY PORTFÖY ALTIN FONU","0,099100","1.135.913.000,00","0","112.569.475,35"
"30.12.2022","ICC","ICBC TURKEY PORTFÖY İKİNCİ DEĞİŞKEN FON","0,326740","34.742.900,00","0","11.351.897,39"
"30.12.2022","ICD","ICBC TURKEY PORTFÖY BİRİNCİ DEĞİŞKEN FON","31,820523","136.790,00","0","4.352.729,30"
"30.12.2022","ICE","ICBC TURKEY PORTFOY PARA PİYASASI (TL) FONU","31,389853","18.799.388,00","0","590.110.026,60"
"30.12.2022","ICF","ICBC TURKEY PORTFÖY HİSSE SENEDİ FONU(HİSSE SENEDİ YOĞUN FON)","57,199817","704.980,00","0","40.324.727,25"
"30.12.2022","ICG","İŞ PORTFÖY ARCADİA SERBEST (DÖVİZ) ÖZEL FON","19,043395","16.886.688,00","1","321.579.877,12"
"30.12.2022","ICK","İŞ PORTFÖY SEKİZİNCİ SERBEST (DÖVİZ) FON","19,694994","24.750.000,00","87","487.451.111,05"
"30.12.2022","ICS","ICBC TURKEY PORTFÖY SERBEST (DÖVİZ) FON","20,787913","144.107,00","1","2.995.683,83"
"30.12.2022","ICU","INVEO PORTFÖY KISA VADELİ SERBEST (TL) FON","1,078785","242.050.584,00","0","261.120.632,35"
"30.12.2022","ICV","ICBC TURKEY PORTFÖY BİRİNCİ SERBEST FON","1,528894","1.505.070,00","0","2.301.093,24"
"30.12.2022","ICZ","AK PORTFÖY TEKNOLOJİ ŞİRKETLERİ HİSSE SENEDİ FONU (HİSSE SENEDİ YOĞUN FON)","2,156455","78.769.663,00","0","169.863.216,77"
"30.12.2022","IDD","LOGOS PORTFÖY DİNAMİK DAĞIMLI SERBEST FON","0,060467","302.573.034,00","6","18.295.756,88"
"30.12.2022","IDF","İŞ PORTFÖY SERBEST (DÖVİZ) FON","23,049689","25.018.492,00","632","576.668.460,62"
"30.12.2022","IDH","İŞ PORTFÖY BIST 100 DIŞI ŞİRKETLER HİSSE SENEDİ (TL)  FONU (HİSSE SENEDİ YOĞUN FON)","3,424687","272.717.804,00","21.408","933.973.048,96"
"30.12.2022","IDL","MÜKAFAT PORTFÖY PARA PİYASASI FONU","1,439292","778.689.997,00","806","1.120.762.373,54"
"30.12.2022","IDP","İSTANBUL PORTFÖY DOĞAN SERBEST ÖZEL FON","2,110772","34.361.480,00","1","72.529.258,61"
"30.12.2022","IDV","İŞ PORTFÖY ACHS SERBEST (DÖVİZ) ÖZEL FON","19,564993","6.775.227,00","2","132.557.266,25"
"30.12.2022","IDY","TEB PORTFÖY İKİNCİ DEĞİŞKEN FON","0,051993","5.132.900.125,13","1.792","266.873.318,21"
"30.12.2022","IEV","İŞ PORTFÖY TAŞIMACILIK DEĞİŞKEN FON","1,335273","18.842.310,00","3.303","25.159.624,24"
"30.12.2022","IEZ","INVEO PORTFÖY ELMA HİSSE SENEDİ SERBEST (TL) ÖZEL FON (HİSSE SENEDİ YOĞUN FON)","0,338268","840.438.239,00","0","284.293.382,22"
"30.12.2022","IFG","INVEO PORTFÖY GEDİK YATIRIM BURSA SERBEST ÖZEL FON","1,364146","248.677.099,00","0","339.231.787,95"
"30.12.2022","IFN","ICBC TURKEY PORTFÖY SÜRDÜRÜLEBİLİRLİK HİSSE SENEDİ FONU(HİSSE SENEDİ YOĞUN FON)","2,926226","3.805.690,00","0","11.136.309,54"
"30.12.2022","IFV","ICBC TURKEY PORTFÖY BİRİNCİ KISA VADELİ BORÇLANMA ARAÇLARI (TL) FONU","1,186042","1.695.930,00","0","2.011.444,56"
"30.12.2022","IFY","İSTANBUL PORTFÖY ÖPY BİRİNCİ SERBEST ÖZEL FON","2,027556","50.078.000,00","1","101.535.926,16"
"30.12.2022","IGF","İŞ PORTFÖY GÜZEL SERBEST (DÖVİZ) ÖZEL FON","19,405032","12.648.242,00","2","245.439.546,15"
"30.12.2022","IGL","TEB PORTFÖY ING BANK PARA PİYASASI (TL) FONU","142,313642","934.494,00","9.935","132.991.244,14"
"30.12.2022","IGM","İŞ PORTFÖY ÜNİ SERBEST (DÖVİZ) ÖZEL FON","19,315728","7.425.718,00","3","143.433.151,30"
"30.12.2022","IGZ","İŞ PORTFÖY ÜNİ SERBEST ÖZEL FON","3,141198","55.509.582,00","3","174.366.594,22"
"30.12.2022","IHC","INVEO PORTFÖY INTER SERBEST FON","1,602445","15.464.086,00","6","24.780.349,90"
"30.12.2022","IHE","INVEO PORTFÖY BEYAZ HİSSE SENEDİ SERBEST (TL) ÖZEL FON (HİSSE SENEDİ YOĞUN FON)","0,931695","178.110.612,00","0","165.944.741,68"
"30.12.2022","IHK","İŞ PORTFÖY İŞ'TE KADIN HİSSE SENEDİ (TL) FONU (HİSSE SENEDİ YOĞUN FON)","4,163794","147.127.999,00","14.734","612.610.651,63"
"30.12.2022","IHN","İŞ PORTFÖY DOKUZUNCU SERBEST (DÖVİZ) FON","19,516928","40.150.000,00","181","783.604.654,01"
"30.12.2022","IHT","İŞ PORTFÖY İHRACATÇI ŞİRKETLER HİSSE SENEDİ FONU (HİSSE SENEDİ YOĞUN FON)","1,489170","72.103.089,00","3.942","107.373.729,48"
"30.12.2022","IHY","İSTANBUL PORTFÖY GMS HİSSE SENEDİ SERBEST ÖZEL FON (HİSSE SENEDİ YOĞUN FON)","0,000000","0,00","0","0,00"
"30.12.2022","IIA","İSTANBUL PORTFÖY ONBİRİNCİ SERBEST (TL) FON","0,000000","0,00","0","0,00"
"30.12.2022","IIC","İSTANBUL PORTFÖY ONÜÇÜNCÜ SERBEST (TL) FON","0,000000","0,00","0","0,00"
"30.12.2022","IIE","İSTANBUL PORTFÖY ONDÖRDÜNCÜ SERBEST (TL) FON","0,000000","0,00","0","0,00"
"30.12.2022","IIH","İSTANBUL PORTFÖY ÜÇÜNCÜ HİSSE SENEDİ FONU (HİSSE SENEDİ YOĞUN FON)","7,123613","10.063.600,00","410","71.689.196,54"
"30.12.2022","IIP","İSTANBUL PORTFÖY ARİES SERBEST FON","0,120667","3.386.009.902,55","111","408.579.173,89"
"30.12.2022","IIS","İSTANBUL PORTFÖY İKİNCİ SERBEST FON","20,327652","87.323.619,94","200","1.775.084.140,82"
"30.12.2022","IJA","INVEO PORTFÖY ATAK DEĞİŞKEN FON","2,992775","35.688.748,00","314","106.808.407,36"
"30.12.2022","IJB","İŞ PORTFÖY DİJİTAL OYUN SEKTÖRÜ KARMA FON","1,710501","47.898.859,00","6.589","81.931.063,17"
"30.12.2022","IJC","İŞ PORTFÖY YARI İLETKEN TEKNOLOJİLERİ DEĞİŞKEN FON","2,619721","239.480.045,00","16.874","627.370.998,92"
"30.12.2022","IJE","İŞ PORTFÖY EFON SERBEST (DÖVİZ) ÖZEL FON","19,135805","15.422.525,00","5","295.122.424,68"
"30.12.2022","IJF","AZİMUT PORTFÖY EREN SERBEST ÖZEL FON","3,098411","124.897.808,00","0","386.984.786,81"
"30.12.2022","IJH","ICBC TURKEY PORTFÖY BİRİNCİ FON SEPETİ FONU","1,588792","2.475.560,00","9","3.933.149,17"
"30.12.2022","IJI","İSTANBUL PORTFÖY HİSSE SENEDİ SERBEST (TL) FON (HİSSE SENEDİ YOĞUN FON )","0,000000","0,00","0","0,00"
"30.12.2022","IJK","İSTANBUL PORTFÖY KEREM SERBEST (DÖVİZ) ÖZEL FON","18,529234","6.503.792,00","3","120.510.285,89"
"30.12.2022","IJL","İSTANBUL PORTFÖY SPİCA SERBEST (DÖVİZ) FON","18,699870","660.147,00","7","12.344.663,36"
"30.12.2022","IJM","İŞ PORTFÖY YAĞMUR SERBEST ÖZEL FON","2,054528","52.745.000,00","1","108.366.082,92"
"30.12.2022","IJP","İŞ PORTFÖY BLOCKCHAİN TEKNOLOJİLERİ KARMA FON","1,656675","77.464.745,00","8.286","128.333.915,93"
"30.12.2022","IJS","İŞ PORTFÖY TÜRK REASÜRANS SERBEST ÖZEL FON","1,461337","173.496.971,00","1","253.537.488,80"
"30.12.2022","IJT","İŞ PORTFÖY TARIM SERBEST FON","2,538699","298.232.792,00","2.603","757.123.357,50"
"30.12.2022","IJV","İSTANBUL PORTFÖY BİRİNCİ PARA PİYASASI (TL) FONU","1,306074","174.512.210,00","102","227.925.891,46"
"30.12.2022","IJZ","İŞ PORTFÖY SİBER GÜVENLİK TEKNOLOJİLERİ DEĞİŞKEN FON","2,426331","72.932.572,00","6.727","176.958.586,23"
"30.12.2022","IKL","İŞ PORTFÖY SAĞLIK ŞİRKETLERİ KARMA FON","2,862483","76.008.919,00","7.251","217.574.206,85"
"30.12.2022","IKP","İŞ PORTFÖY YENİLENEBİLİR ENERJİ KARMA FON","2,293921","202.422.508,00","11.815","464.341.151,00"
"30.12.2022","ILJ","İSTANBUL PORTFÖY GSB SERBEST (DÖVİZ) ÖZEL FON","18,159504","9.471.341,00","1","171.994.856,37"
"30.12.2022","ILM","İSTANBUL PORTFÖY ONUNCU SERBEST FON","2,106150","36.747.600,00","9","77.395.962,75"
"30.12.2022","ILR","İŞ PORTFÖY SALUR SERBEST ÖZEL FON","1,377690","190.325.595,00","2","262.209.633,61"
"30.12.2022","ILZ","İŞ PORTFÖY TEMKİNLİ FON SEPETİ FONU","1,819703","70.035.083,00","1.833","127.443.032,63"
"30.12.2022","IMF","İSTANBUL PORTFÖY MAESTRO SERBEST FON","1,936786","195.340.164,00","27","378.332.169,55"
"30.12.2022","IMH","İŞ PORTFÖY ANADOLU HAYAT EMEKLİLİK SERBEST ÖZEL FON","2,403217","58.171.355,00","1","139.798.416,59"
"30.12.2022","IMO","İŞ PORTFÖY ODAK SERBEST ÖZEL FON","2,330669","205.984.965,00","2","480.082.781,40"
"30.12.2022","IMS","İŞ PORTFÖY MERMER SERBEST ÖZEL FON","4,086064","51.323.550,00","4","209.711.331,57"
"30.12.2022","IMT","İŞ PORTFÖY TOROS SERBEST (DÖVİZ) ÖZEL FON","19,702784","7.760.584,00","2","152.905.111,92"
"30.12.2022","IMY","İŞ PORTFÖY SKYLARK SERBEST (DÖVİZ) ÖZEL FON","21,715468","22.869.719,00","6","496.626.651,62"
"30.12.2022","IMZ","İŞ PORTFÖY POYRAZ SERBEST (DÖVİZ) ÖZEL FON","20,400336","4.315.794,00","6","88.043.649,54"
"30.12.2022","INH","GARANTİ PORTFÖY ING BANK ÖZEL BANKACILIK VE PLATİNUM DEĞİŞKEN ÖZEL FON","3,383760","23.039.943,00","304","77.961.631,36"
"30.12.2022","INV","INVEO PORTFÖY İSTATİSTİKSEL ARBİTRAJ SERBEST (TL) ÖZEL FON","11,131773","42.614.927,00","3","474.379.693,39"
"30.12.2022","INZ","INVEO PORTFÖY İSTATİSTİKSEL ARBİTRAJ SERBEST (TL) FON","1,163137","3.181.517,00","27","3.700.539,80"
"30.12.2022","IOG","İŞ PORTFÖY GÜMÜŞ SERBEST FON","2,097110","167.063.122,00","904","350.349.795,44"
"30.12.2022","IOJ","İŞ PORTFÖY ONUNCU SERBEST (DÖVİZ) FON","18,694830","21.335.000,00","94","398.854.199,25"
"30.12.2022","IOL","İŞ PORTFÖY OSK SERBEST (DÖVİZ) ÖZEL FON","19,495655","5.286.662,00","1","103.066.937,99"
"30.12.2022","ION","İSTANBUL PORTFÖY ONİKİNCİ SERBEST FON","0,000000","0,00","0","0,00"
"30.12.2022","IOO","İŞ PORTFÖY İKİNCİ PARA PİYASASI (TL) FONU","1,105748","5.253.264.416,00","37","5.808.788.837,38"
"30.12.2022","IOP","İŞ PORTFÖY ODEABANK PARA PİYASASI (TL) FONU","1,502910","220.090.240,00","1.679","330.775.930,89"
"30.12.2022","IOV","İSTANBUL PORTFÖY PAPİRUS SERBEST (DÖVİZ) ÖZEL FON","18,358690","5.400.000,00","1","99.136.927,75"
"30.12.2022","IPA","İŞ PORTFÖY SÜTAŞ İKİNCİ SERBEST ÖZEL FON","0,198592","390.634.614,00","16","77.576.886,33"
"30.12.2022","IPB","İSTANBUL PORTFÖY BİRİNCİ DEĞİŞKEN FON","0,171124","641.157.897,57","2.597","109.717.398,84"
"30.12.2022","IPC","İŞ PORTFÖY CK SERBEST ÖZEL FON","8,164661","3.438.000,00","1","28.070.103,23"
"30.12.2022","IPE","İŞ PORTFÖY ANADOLU SİGORTA SERBEST ÖZEL FON","3,682467","162.054.085,00","2","596.758.845,26"
"30.12.2022","IPF","PERFORM PORTFÖY İKİNCİ SERBEST FON","0,034927","1.754.602.224,00","0","61.283.705,86"
"30.12.2022","IPG","İŞ PORTFÖY ATAK FON SEPETİ FONU","2,591739","57.646.405,00","840","149.404.435,11"
"30.12.2022","IPJ","İŞ PORTFÖY ELEKTRİKLİ ARAÇLAR KARMA FON","4,773866","243.186.325,00","29.769","1.160.938.959,85"
"30.12.2022","IPK","İŞ PORTFÖY KOS SERBEST ÖZEL FON","10,043481","64.747.074,00","1","650.285.988,32"
"30.12.2022","IPO","İŞ PORTFÖY ONUR SERBEST ÖZEL FON","9,758181","27.387.222,00","1","267.249.460,19"
"30.12.2022","IPP","PERFORM PORTFÖY BIRINCI SERBEST FON","0,035533","9.731.135.928,00","0","345.776.087,27"
"30.12.2022","IPR","İŞ PORTFÖY ICARUS SERBEST ÖZEL FON","9,250074","25.473.611,00","3","235.632.786,64"
"30.12.2022","IPU","İŞ PORTFÖY AS SERBEST ÖZEL FON","8,820910","116.663.621,00","1","1.029.079.248,22"
"30.12.2022","IPV","İŞ PORTFÖY EUROBOND BORÇLANMA ARAÇLARI (DÖVİZ) FONU","23,252891","79.715.559,00","15.963","1.853.617.168,24"
"30.12.2022","IRA","İŞ PORTFÖY ALGORİTMİK STRATEJİLER SERBEST (TL) FON","1,013174","2.500.000,00","5","2.532.935,40"
"30.12.2022","IRF","İSTANBUL PORTFÖY BİRİNCİ FON SEPETİ FONU","1,232194","28.586.078,00","147","35.223.605,51"
"30.12.2022","IRL","İSTANBUL PORTFÖY KEY SERBEST FON","3,155531","49.846.988,00","6","157.293.723,17"
"30.12.2022","IRT","INVEO PORTFÖY TEKNOLOJİ DEĞİŞKEN FON","1,199202","11.754.490,00","106","14.096.012,51"
"30.12.2022","IRV","İSTANBUL PORTFÖY İSTATİSTİKSEL ARBİTRAJ SERBEST FON","1,758625","319.631.095,00","106","562.111.256,03"
"30.12.2022","ISR","İŞ PORTFÖY BİRİNCİ SERBEST ÖZEL FON","5,450412","10.785.405,00","1","58.784.901,95"
"30.12.2022","ISS","İŞ PORTFÖY DEĞER SERBEST ÖZEL FON","0,058817","699.888.225,00","7","41.165.004,85"
"30.12.2022","IST","İSTANBUL PORTFÖY KISA VADELİ BORÇLANMA ARAÇLARI (TL) FONU","0,046073","14.656.617.022,24","1.774","675.272.943,82"
"30.12.2022","ITD","İŞ PORTFÖY TE2 SERBEST (DÖVİZ) ÖZEL FON","18,953891","36.838.863,00","1","698.239.786,56"
"30.12.2022","ITJ","İSTANBUL PORTFÖY SEKİZİNCİ SERBEST FON","2,389765","435.440.040,00","1","1.040.599.211,41"
"30.12.2022","ITL","İŞ PORTFÖY DELTA SERBEST (TL) FON","1,009604","5.000.000,00","1","5.048.022,44"
"30.12.2022","ITP","İŞ PORTFÖY TEKNOLOJİ KARMA FON","2,031355","92.250.492,00","7.034","187.393.538,56"
"30.12.2022","ITR","İŞ PORTFÖY TE1 SERBEST ÖZEL FON","1,014952","204.520.000,00","1","207.577.986,10"
"30.12.2022","ITV","İŞ PORTFÖY ALTINCI SERBEST (DÖVİZ) FON","19,218120","15.100.000,00","60","290.193.613,04"
"30.12.2022","IUA","İSTANBUL PORTFÖY KARYA SERBEST (DÖVİZ) FON","19,841884","7.712.941,00","43","153.039.278,20"
"30.12.2022","IUB","İŞ PORTFÖY EVREN SERBEST (DÖVİZ) ÖZEL FON","20,033369","3.914.287,00","3","78.416.357,71"
"30.12.2022","IUC","INVEO PORTFÖY GEDİK YATIRIM SERBEST (TL) ÖZEL FON","1,810580","68.153.100,00","1","123.396.645,75"
"30.12.2022","IUF","İŞ PORTFÖY YEDİNCİ SERBEST (DÖVİZ-AVRO) FON","20,283485","5.183.516,00","96","105.139.771,37"
"30.12.2022","IUH","INVEO PORTFÖY DÖNÜŞTÜRÜCÜ TEKNOLOJİLER FON SEPETİ FONU","1,289892","1.526.606,00","26","1.969.157,44"
"30.12.2022","IUM","İŞ PORTFÖY HK SERBEST (DÖVİZ) ÖZEL FON","19,576703","3.409.713,00","1","66.750.938,04"
"30.12.2022","IUN","İŞ PORTFÖY YELKEN SERBEST (DÖVİZ) ÖZEL FON","20,302053","3.697.936,00","4","75.075.692,02"
"30.12.2022","IUS","İŞ PORTFÖY OKYANUS SERBEST (TL) ÖZEL FON","1,247159","47.699.895,00","1","59.489.359,83"
"30.12.2022","IUT","INVEO PORTFÖY ESG SÜRDÜRÜLEBİLİRLİK FON SEPETİ FONU","1,554998","2.711.374,00","27","4.216.182,20"
"30.12.2022","IUU","İŞ PORTFÖY ÜÇÜNCÜ SERBEST (DÖVİZ) FON","22,375635","2.600.000,00","5","58.176.651,43"
"30.12.2022","IUV","İŞ PORTFÖY BEŞİNCİ SERBEST (DÖVİZ)  FON","19,115622","14.830.039,00","190","283.485.416,07"
"30.12.2022","IUZ","İŞ PORTFÖY ANADOLUBANK PARA PİYASASI (TL) FONU","1,156914","50.010.000,00","2","57.857.269,24"
"30.12.2022","IVA","İSTANBUL PORTFÖY BAYRAKTAR SERBEST ÖZEL FON","0,000000","0,00","0","0,00"
"30.12.2022","IVF","İSTANBUL PORTFÖY KATILIM HİSSE SENEDİ (TL) FONU (HİSSE SENEDİ YOĞUN FON)","1,730537","45.216.497,00","264","78.248.810,40"
"30.12.2022","IVS","İSTANBUL PORTFÖY İKİNCİ İSTATİSTİKSEL ARBİTRAJ SERBEST FON","1,469903","193.193.661,00","94","283.976.011,42"
"30.12.2022","IVY","İSTANBUL PORTFÖY BLOCKCHAİN TEKNOLOJİLERİ KARMA FON","0,716719","18.275.780,00","1.912","13.098.593,19"
"30.12.2022","IV2","INVEO PORTFÖY ARİSTA KAR PAYI ÖDEYEN SERBEST ÖZEL FON","1,376248","39.379.510,00","0","54.195.974,81"
"30.12.2022","IV5","INVEO PORTFÖY ŞAHİNKAYA 1 HİSSE SENEDİ SERBEST (TL) ÖZEL FON (HİSSE SENEDİ YOĞUN FON)","0,966764","23.074.431,00","0","22.307.529,53"
"30.12.2022","IV6","INVEO PORTFÖY TE3 SERBEST (DÖVİZ) ÖZEL FON","18,683213","25.018.417,00","0","467.424.423,53"
"30.12.2022","IV7","INVEO PORTFÖY BEŞER SERBEST (TL) ÖZEL FON","0,979898","32.679.672,00","0","32.022.732,45"
"30.12.2022","IYB","AURA PORTFÖY DEĞİŞKEN FONU","1,383764","34.822.532,00","56","48.186.173,04"
"30.12.2022","IYP","İSTANBUL PORTFÖY YILDIZ SERBEST ÖZEL FON","3,875025","1.652.183.330,00","3","6.402.252.383,39"
"30.12.2022","IYR","İŞ PORTFÖY HEDEF SERBEST FON","0,054333","5.440.074.391,00","44","295.575.887,93"
"30.12.2022","IYS","İŞ PORTFÖY SÜTAŞ SERBEST ÖZEL FON","0,330332","4.692.384.648,00","19","1.550.046.165,27"
"30.12.2022","IZB","İSTANBUL PORTFÖY BİRİNCİ FON SEPETİ SERBEST FON","2,520510","22.739.224,00","39","57.314.440,99"
"30.12.2022","IZE","İŞ PORTFÖY ÜÇÜNCÜ SERBEST (DÖVİZ) ÖZEL FON","19,162576","5.440.223,00","1","104.248.684,14"
"30.12.2022","IZF","QİNVEST PORTFÖY İKİNCİ KATILIM SERBEST FON","1,556953","1.322.380,00","0","2.058.883,11"
"30.12.2022","IZL","İŞ PORTFÖY ODEABANK SERBEST (DÖVİZ) ÖZEL FON","19,512263","10.712.035,00","115","209.016.048,16"
"30.12.2022","IZS","İSTANBUL PORTFÖY ALTINCI SERBEST FON","3,151153","10.417.814,00","43","32.828.128,15"
"30.12.2022","IZV","İSTANBUL PORTFÖY ATLANTİK SERBEST (TL) ÖZEL FON","2,340854","122.028.095,00","2","285.649.931,32"
"30.12.2022","IZZ","İŞ PORTFÖY CORTİNA SERBEST ÖZEL FON","4,780528","162.763.310,00","1","778.094.636,18"
"30.12.2022","KAC","ALBARAKA PORTFÖY EMLAK KATILIM KISA VADELİ KATILIM SERBEST (TL) FON","1,056851","1.486.761.479,00","6","1.571.284.945,29"
